{
  "dataset": "d365-finops-pqu",
  "schema_version": "1.1.0",
  "generated_at": "2026-10-19T19:11:52.848489Z",
  "source": {
    "publisher": "Microsoft",
    "repository": "MicrosoftDocs/dynamics-365-unified-operations-public",
    "branch": "main",
    "file_path": "articles/fin-ops-core/dev-itpro/get-started/quality-updates-schedule.md",
    "commit": "cb977385a7ab71c306533725527086bc30d9f548",
    "article_url": "https://learn.microsoft.com/en-us/dynamics365/fin-ops-core/dev-itpro/get-started/quality-updates-schedule",
    "raw_url": "https://raw.githubusercontent.com/MicrosoftDocs/dynamics-365-unified-operations-public/cb977385a7ab71c306533725527086bc30d9f548/articles/fin-ops-core/dev-itpro/get-started/quality-updates-schedule.md",
    "markdown_date": "2026-10-13",
    "sha256": "2cc9773677d90a03e730b761f4f7825cde114e0f72564b27e14fae4ae902a588",
    "retrieved_at": "2026-10-19T19:11:52.848489Z"
  },
  "count": 137,
  "records": [
    {
      "change_id": "7f6ef8e13f4b3ae236ca",
      "changed_at": "2026-09-29T13:39:53.051448Z",
      "pqu_id": "10.0.48-PQU-5",
      "entity": "pqu",
      "change_type": "modified",
      "field": "status",
      "old_value": "In-Progress",
      "new_value": "Completed",
      "source_commit": "f5356378cee582265b31fa0900bf6fbebaaba88f"
    },
    {
      "change_id": "34e5903cd792fb7ec94e",
      "changed_at": "2026-09-29T13:39:53.051448Z",
      "pqu_id": "10.0.48-PQU-7",
      "entity": "pqu",
      "change_type": "modified",
      "field": "status",
      "old_value": "Not Started",
      "new_value": "In-Progress",
      "source_commit": "f5356378cee582265b31fa0900bf6fbebaaba88f"
    },
    {
      "change_id": "04f69c27f9a807380d06",
      "changed_at": "2026-09-29T13:39:53.051448Z",
      "pqu_id": "10.0.48-PQU-7",
      "entity": "pqu",
      "change_type": "modified",
      "field": "application_build",
      "old_value": null,
      "new_value": "10.0.2645.147",
      "source_commit": "f5356378cee582265b31fa0900bf6fbebaaba88f"
    },
    {
      "change_id": "b9e58c9c97ef54ef392d",
      "changed_at": "2026-09-29T13:39:53.051448Z",
      "pqu_id": "10.0.48-PQU-7",
      "entity": "pqu",
      "change_type": "modified",
      "field": "platform_build",
      "old_value": null,
      "new_value": "7.0.7996.122",
      "source_commit": "f5356378cee582265b31fa0900bf6fbebaaba88f"
    },
    {
      "change_id": "feedd0841df82dd683bb",
      "changed_at": "2026-09-29T13:39:53.051448Z",
      "pqu_id": "10.0.48-PQU-7",
      "entity": "pqu",
      "change_type": "modified",
      "field": "uep_version",
      "old_value": null,
      "new_value": "10.0.48.8",
      "source_commit": "f5356378cee582265b31fa0900bf6fbebaaba88f"
    },
    {
      "change_id": "3bf303cfd068dcb69086",
      "changed_at": "2026-09-29T13:39:53.051448Z",
      "pqu_id": "10.0.48-PQU-7",
      "entity": "pqu",
      "change_type": "modified",
      "field": "station_schedule_available",
      "old_value": false,
      "new_value": true,
      "source_commit": "f5356378cee582265b31fa0900bf6fbebaaba88f"
    },
    {
      "change_id": "e21a1f59ceac020ae327",
      "changed_at": "2026-09-29T13:39:53.051448Z",
      "pqu_id": "10.0.48-PQU-7",
      "entity": "station",
      "change_type": "added",
      "field": "station.1",
      "old_value": null,
      "new_value": {
        "sandbox_start_date": "2026-09-30",
        "sandbox_end_date": "2026-10-03",
        "production_start_date": null,
        "production_end_date": null
      },
      "source_commit": "f5356378cee582265b31fa0900bf6fbebaaba88f"
    },
    {
      "change_id": "e1064d507d317681bb46",
      "changed_at": "2026-09-29T13:39:53.051448Z",
      "pqu_id": "10.0.48-PQU-7",
      "entity": "station",
      "change_type": "added",
      "field": "station.2",
      "old_value": null,
      "new_value": {
        "sandbox_start_date": "2026-10-05",
        "sandbox_end_date": "2026-10-08",
        "production_start_date": "2026-10-10",
        "production_end_date": "2026-10-11"
      },
      "source_commit": "f5356378cee582265b31fa0900bf6fbebaaba88f"
    },
    {
      "change_id": "648a0cf6ecfddf01ee59",
      "changed_at": "2026-09-29T13:39:53.051448Z",
      "pqu_id": "10.0.48-PQU-7",
      "entity": "station",
      "change_type": "added",
      "field": "station.3",
      "old_value": null,
      "new_value": {
        "sandbox_start_date": "2026-10-05",
        "sandbox_end_date": "2026-10-08",
        "production_start_date": "2026-10-10",
        "production_end_date": "2026-10-11"
      },
      "source_commit": "f5356378cee582265b31fa0900bf6fbebaaba88f"
    },
    {
      "change_id": "e0cd9317cf7d5dd3977b",
      "changed_at": "2026-09-29T13:39:53.051448Z",
      "pqu_id": "10.0.48-PQU-7",
      "entity": "station",
      "change_type": "added",
      "field": "station.4",
      "old_value": null,
      "new_value": {
        "sandbox_start_date": "2026-10-12",
        "sandbox_end_date": "2026-10-15",
        "production_start_date": "2026-10-17",
        "production_end_date": "2026-10-18"
      },
      "source_commit": "f5356378cee582265b31fa0900bf6fbebaaba88f"
    },
    {
      "change_id": "d6633da91be1ef1a9d33",
      "changed_at": "2026-09-29T13:39:53.051448Z",
      "pqu_id": "10.0.48-PQU-7",
      "entity": "station",
      "change_type": "added",
      "field": "station.5",
      "old_value": null,
      "new_value": {
        "sandbox_start_date": "2026-10-19",
        "sandbox_end_date": "2026-10-22",
        "production_start_date": "2026-10-24",
        "production_end_date": "2026-10-25"
      },
      "source_commit": "f5356378cee582265b31fa0900bf6fbebaaba88f"
    },
    {
      "change_id": "be95a7611f947415bf21",
      "changed_at": "2026-09-29T13:39:53.051448Z",
      "pqu_id": "10.0.48-PQU-7",
      "entity": "station",
      "change_type": "added",
      "field": "station.6",
      "old_value": null,
      "new_value": {
        "sandbox_start_date": "2026-10-19",
        "sandbox_end_date": "2026-10-22",
        "production_start_date": "2026-10-24",
        "production_end_date": "2026-10-25"
      },
      "source_commit": "f5356378cee582265b31fa0900bf6fbebaaba88f"
    },
    {
      "change_id": "b6e15342f671372f60e6",
      "changed_at": "2026-10-05T13:14:25.524832Z",
      "pqu_id": "10.0.46-PQU-8",
      "entity": "pqu",
      "change_type": "modified",
      "field": "status",
      "old_value": "In-Progress",
      "new_value": "Completed",
      "source_commit": "aee43141bb5f24e63c1e63805dcd9e1c5452c334"
    },
    {
      "change_id": "48583fe0e2e45a38d79f",
      "changed_at": "2026-10-05T13:14:25.524832Z",
      "pqu_id": "10.0.46-PQU-8",
      "entity": "pqu",
      "change_type": "modified",
      "field": "uep_version",
      "old_value": "10.0.46.10",
      "new_value": null,
      "source_commit": "aee43141bb5f24e63c1e63805dcd9e1c5452c334"
    },
    {
      "change_id": "3525187000bb4a0583f7",
      "changed_at": "2026-10-05T13:14:25.524832Z",
      "pqu_id": "10.0.46-PQU-8",
      "entity": "pqu",
      "change_type": "modified",
      "field": "station_schedule_available",
      "old_value": true,
      "new_value": false,
      "source_commit": "aee43141bb5f24e63c1e63805dcd9e1c5452c334"
    },
    {
      "change_id": "3ecbaefe8eddd4367ace",
      "changed_at": "2026-10-05T13:14:25.524832Z",
      "pqu_id": "10.0.47-PQU-12",
      "entity": "pqu",
      "change_type": "modified",
      "field": "status",
      "old_value": "In-Progress",
      "new_value": "Completed",
      "source_commit": "aee43141bb5f24e63c1e63805dcd9e1c5452c334"
    },
    {
      "change_id": "8e0453bf1f8f6fd53db9",
      "changed_at": "2026-10-05T13:14:25.524832Z",
      "pqu_id": "10.0.47-PQU-12",
      "entity": "pqu",
      "change_type": "modified",
      "field": "uep_version",
      "old_value": "10.0.47.13",
      "new_value": null,
      "source_commit": "aee43141bb5f24e63c1e63805dcd9e1c5452c334"
    },
    {
      "change_id": "d9a11182caf0371f997d",
      "changed_at": "2026-10-05T13:14:25.524832Z",
      "pqu_id": "10.0.47-PQU-12",
      "entity": "pqu",
      "change_type": "modified",
      "field": "station_schedule_available",
      "old_value": true,
      "new_value": false,
      "source_commit": "aee43141bb5f24e63c1e63805dcd9e1c5452c334"
    },
    {
      "change_id": "340970f957251a491fc1",
      "changed_at": "2026-10-05T13:14:25.524832Z",
      "pqu_id": "10.0.47-PQU-14",
      "entity": "pqu",
      "change_type": "modified",
      "field": "status",
      "old_value": "Not Started",
      "new_value": "In-Progress",
      "source_commit": "aee43141bb5f24e63c1e63805dcd9e1c5452c334"
    },
    {
      "change_id": "cd7d87dcf2447f58ec98",
      "changed_at": "2026-10-05T13:14:25.524832Z",
      "pqu_id": "10.0.47-PQU-14",
      "entity": "pqu",
      "change_type": "modified",
      "field": "application_build",
      "old_value": null,
      "new_value": "10.0.2527.227",
      "source_commit": "aee43141bb5f24e63c1e63805dcd9e1c5452c334"
    },
    {
      "change_id": "7041c19b21006356e134",
      "changed_at": "2026-10-05T13:14:25.524832Z",
      "pqu_id": "10.0.47-PQU-14",
      "entity": "pqu",
      "change_type": "modified",
      "field": "platform_build",
      "old_value": null,
      "new_value": "7.0.7858.178",
      "source_commit": "aee43141bb5f24e63c1e63805dcd9e1c5452c334"
    },
    {
      "change_id": "604ecff5ac71e5ac8f0a",
      "changed_at": "2026-10-05T13:14:25.524832Z",
      "pqu_id": "10.0.47-PQU-14",
      "entity": "pqu",
      "change_type": "modified",
      "field": "uep_version",
      "old_value": null,
      "new_value": "10.0.47.15",
      "source_commit": "aee43141bb5f24e63c1e63805dcd9e1c5452c334"
    },
    {
      "change_id": "0e9808e27ce545306b13",
      "changed_at": "2026-10-05T13:14:25.524832Z",
      "pqu_id": "10.0.47-PQU-14",
      "entity": "pqu",
      "change_type": "modified",
      "field": "station_schedule_available",